{
  "$schema": "../../schemas/gcp-cost-components.schema.json",
  "title": "GCP Cost Component Catalog — Usage Quantity Estimation",
  "version": "1.0.0",
  "source": "Company GCP billing SKU catalog (finance). The skuDescription strings are verbatim billing-export labels — never reword, abbreviate, or localize them; the CSV must match them character-for-character so finance can VLOOKUP against the billing export.",
  "region": {
    "compute": "Jakarta (asia-southeast2)",
    "gcsBuckets": "Bangkok (asia-southeast1 — 'Standard Storage Bangkok' SKU)",
    "note": "Compute (GKE, Cloud SQL, Load Balancing) is Jakarta; the GCS bucket SKU in this catalog is Bangkok. Cross-region egress between Bangkok storage and Jakarta compute is NOT a SKU in this catalog — if the code reads/writes GCS on the request path, flag potential cross-region egress as a gap for the owner, do not invent a SKU for it. Region is a company fact encoded here; do not assume a different region from code."
  },
  "quantitiesOnlyRule": "This plugin estimates USAGE QUANTITIES only — never prices, rates, currency, or a monthly bill total. Finance owns unit prices and enters them in their own costing sheet against these quantities. If the user asks 'how much will this cost' in money, decline that part, explain that pricing is finance's job, and still deliver the quantities. Producing a money figure would require inventing rates, which are stale the moment they are memorized.",
  "evidenceRule": "Interview answers are claims, not facts. Verify every answer against the target codebase using each question's codebaseSignals; mark it CONFIRMED, CONTRADICTED (cite file:line), or UNVERIFIABLE. For RESOURCE facts the code settles — replica counts, cpu/memory requests, PVC sizes, which dependencies are present, Service type — evidence wins: if the overlay says 6 replicas and the owner says 2, estimate from 6 and record the conflict. For TRAFFIC, GROWTH, and SIZING the code cannot settle — requests/month, payload sizes, storage growth, DB instance size, image sizes — the owner's number governs; code signals only sanity-check magnitude (an HPA maxReplicas or a rate-limit config caps plausibility) and never replace the owner's figure. An unanswered traffic input keeps its ⚠️ gap, uses the stated default, and is marked UNVERIFIABLE in the doc.",
  "conventions": {
    "hoursPerMonth": 730,
    "hoursNote": "Use 730 hours/month (365*24/12) for every per-hour SKU — cluster-hours, vCPU-hours, GiB-hours, forwarding-rule-hours, HSM-hours. State it once in the doc assumptions.",
    "gib": "1 GiB = 1024^3 bytes. Convert payload KB to GiB by dividing by 1048576 (1024^2), treating 1 KB as 1 KiB — state this simplification. GCP bills data processing and storage in binary GiB.",
    "rounding": "Round vCPU counts and node counts UP to whole units (you cannot buy a fractional node). Report GiB-month and GiB to 2 decimals. Round operation counts UP to the nearest 1000. Never round a computed demand quantity DOWN — that would under-provision.",
    "headroom": "When node-pool machine shapes are NOT pinned in the repo, derive billed node capacity from pod requests divided by binPackingUtilization (default 0.70) to cover system/daemonset pods and bin-packing waste. Always state the factor used. When machine shapes ARE pinned (Terraform google_container_node_pool machine_type, gcloud scripts), use the pinned node count * shape and cite it — do not re-derive.",
    "environmentColumns": "Every quantity is reported for two environments: Staging and Production. A SKU that does not run in an environment gets quantity 0 with an 'N/A — <reason>' note, never a blank."
  },
  "trafficModel": {
    "description": "Shared usage inputs that multiple cost components derive from. Gather these once in a single interview batch (they are what code cannot reveal), verify magnitude against any code signals, then substitute into the component formulas as $id tokens. Each var is captured per environment unless noted global.",
    "vars": [
      {
        "id": "requests_per_month",
        "question": "How many HTTP requests per month does each environment serve? (or give average RPS — requests/month = RPS * 2628000)",
        "unit": "requests/month",
        "perEnvironment": true,
        "ownerConfirmed": true,
        "codebaseSignals": [
          "Rate-limiter configs (express-rate-limit, nginx limit_req, API gateway quotas) — a ceiling sanity check",
          "HPA maxReplicas as an upper bound on sustainable throughput",
          "Analytics/metrics middleware or existing dashboards that already count requests"
        ],
        "defaultHint": { "staging": "5% of production unless the owner gives a figure", "production": null }
      },
      {
        "id": "avg_request_kb",
        "question": "Average inbound request size in KB (body + headers)? APIs are often 1-5 KB; upload endpoints far larger.",
        "unit": "KB",
        "perEnvironment": true,
        "ownerConfirmed": true,
        "codebaseSignals": ["Body-size limits (express.json limit, multer limits, nginx client_max_body_size)", "Upload/multipart handlers imply large requests"],
        "defaultHint": { "staging": null, "production": null }
      },
      {
        "id": "avg_response_kb",
        "question": "Average outbound response size in KB? JSON APIs are often 2-20 KB; media/file downloads far larger.",
        "unit": "KB",
        "perEnvironment": true,
        "ownerConfirmed": true,
        "codebaseSignals": ["Pagination page sizes", "Endpoints that stream files or proxy media"],
        "defaultHint": { "staging": null, "production": null }
      },
      {
        "id": "dau",
        "question": "Daily active users per environment? (optional cross-check: requests/month ≈ DAU * requests-per-user-per-day * 30.4)",
        "unit": "users/day",
        "perEnvironment": true,
        "ownerConfirmed": true,
        "codebaseSignals": ["Session/user tables give an order of magnitude only, never live DAU"],
        "defaultHint": { "staging": null, "production": null }
      },
      {
        "id": "writes_share_pct",
        "question": "What percentage of requests write data (create/update/delete) versus read? Drives per-write KMS encryption and blind-index operations.",
        "unit": "percent",
        "perEnvironment": true,
        "ownerConfirmed": true,
        "codebaseSignals": ["Ratio of mutating routes (POST/PUT/PATCH/DELETE) to GET routes", "Write-heavy queue consumers or ingestion jobs"],
        "defaultHint": { "staging": "same % as production", "production": "20% if unknown, flagged" }
      },
      {
        "id": "gcs_initial_gib",
        "question": "How much object data is in Cloud Storage today (or expected at launch), in GiB, per environment?",
        "unit": "GiB",
        "perEnvironment": true,
        "ownerConfirmed": true,
        "codebaseSignals": ["@google-cloud/storage usage confirms a bucket exists; GCS_BUCKET/GCS_FOLDER in .env.example", "What gets uploaded (avatars vs videos) hints at magnitude"],
        "defaultHint": { "staging": null, "production": null }
      },
      {
        "id": "gcs_growth_gib_per_month",
        "question": "How many GiB of object storage are added per month, per environment?",
        "unit": "GiB/month",
        "perEnvironment": true,
        "ownerConfirmed": true,
        "codebaseSignals": ["Upload frequency implied by feature set; no lifecycle/deletion policy means storage only grows"],
        "defaultHint": { "staging": null, "production": null }
      },
      {
        "id": "db_provisioned_gib",
        "question": "Provisioned Cloud SQL storage in GiB per environment today (not used — provisioned; Cloud SQL bills provisioned/auto-grown storage)?",
        "unit": "GiB",
        "perEnvironment": true,
        "ownerConfirmed": true,
        "codebaseSignals": ["Migrations/schema hint at data model but never at provisioned size — instance sizing lives in Terraform/gcloud, usually outside the app repo"],
        "defaultHint": { "staging": null, "production": null }
      },
      {
        "id": "db_growth_gib_per_month",
        "question": "How many GiB does the database grow per month, per environment? (Cloud SQL auto-storage-increase never shrinks.)",
        "unit": "GiB/month",
        "perEnvironment": true,
        "ownerConfirmed": true,
        "codebaseSignals": ["High-volume insert paths, event/audit tables, retention with no purge job"],
        "defaultHint": { "staging": null, "production": null }
      },
      {
        "id": "deploys_per_month",
        "question": "How many image builds/deploys per month push a new image to Artifact Registry?",
        "unit": "deploys/month",
        "perEnvironment": false,
        "ownerConfirmed": true,
        "codebaseSignals": ["CI workflow triggers (on push to main, tags); a docker build+push step in .github/workflows or Jenkinsfile"],
        "defaultHint": { "staging": null, "production": null }
      },
      {
        "id": "avg_image_size_gib",
        "question": "Compressed container image size in GiB? Slim Node images ~0.1-0.3 GiB; images with build toolchains or ML libs multiple GiB.",
        "unit": "GiB",
        "perEnvironment": false,
        "ownerConfirmed": true,
        "codebaseSignals": ["Base image in Dockerfile (alpine/slim vs full)", "Multi-stage build (smaller final) vs single stage", "Heavy deps (puppeteer, tensorflow) inflate size"],
        "defaultHint": { "staging": null, "production": null }
      },
      {
        "id": "image_versions_retained",
        "question": "How many image versions are kept in Artifact Registry (is there a cleanup policy, or do all tags accumulate)?",
        "unit": "versions",
        "perEnvironment": false,
        "ownerConfirmed": true,
        "codebaseSignals": ["Artifact Registry cleanup policy in Terraform/gcloud; absence means images accumulate = deploys_per_month * retention_months"],